[
  {
    "basis_relation": {
      "content_hash": "581e878e89d23bced56b5b8968e9c495e0cbb043e8094a8bae58ccab39e36af0",
      "id": "bridge-465f80f2a3e50411",
      "revision": 1
    },
    "content_hash": "816f57920ce71f6c465e6d9c431bca0787187639cf38eeb53beeabd3b07811c4",
    "from": {
      "content_hash": "889176f61fc028c97a0ea4730afecbc69c6b349272ce4ba03781662247ff9f65",
      "id": "w-source-7edb5c263f75a465",
      "revision": 1
    },
    "id": "wr-83cf8338b59779ab",
    "kind": "insight_projection",
    "predicate": "historical_basis_for",
    "provenance": [
      {
        "note": "Evidence anchor p3 at source revision 1",
        "title": "The sphere packing problem in dimension 8",
        "url": "https://arxiv.org/pdf/1603.04246"
      },
      {
        "note": "Evidence anchor p4 at source revision 1",
        "title": "The sphere packing problem in dimension 8",
        "url": "https://arxiv.org/pdf/1603.04246"
      }
    ],
    "revision": 1,
    "scope": "This connection concerns the linked insights within these works, not every claim or the entire history of either work.",
    "to": {
      "content_hash": "8d78387e58084993ac0fb774d8c2d50399ed3ad0a6f21ec46d1ea7825ccd345a",
      "id": "w-source-7414b1e9b6725a75",
      "revision": 1
    },
    "warrant": "Viazovska's paper explicitly states 'In 2003 Cohn and Elkies [4] developed linear programming bounds that apply directly to sphere packings' and then uses Theorem 2 (Cohn, Elkies) as the key tool to prove her main result, constructing an optimal function g that satisfies the Cohn–Elkies conditions."
  },
  {
    "basis_relation": {
      "content_hash": "756977983a3edacd4ae7d97ea32d62e5b23ad53edb03ffbfa6d3ecd641ef28db",
      "id": "bridge-60e8498cc4e2d98c",
      "revision": 1
    },
    "content_hash": "03e338ca458fb9f6a2913b2706df61e7d41221408e38523c53ba3b858e3b2d20",
    "from": {
      "content_hash": "18c7b3ffeea3a9905171974dd551fc078dd40b2be20658941db80c7e46980e27",
      "id": "w-source-057b1d8c009ba859",
      "revision": 1
    },
    "id": "wr-ce4c9d48ed329258",
    "kind": "insight_projection",
    "predicate": "historical_basis_for",
    "provenance": [
      {
        "note": "Evidence anchor p14 at source revision 1",
        "title": "Accurate structure prediction of biomolecular interactions with AlphaFold 3",
        "url": "https://www.ebi.ac.uk/europepmc/webservices/rest/PMC11168924/fullTextXML"
      },
      {
        "note": "Evidence anchor p2 at source revision 1",
        "title": "Accurate structure prediction of biomolecular interactions with AlphaFold 3",
        "url": "https://www.ebi.ac.uk/europepmc/webservices/rest/PMC11168924/fullTextXML"
      }
    ],
    "revision": 1,
    "scope": "This connection concerns the linked insights within these works, not every claim or the entire history of either work.",
    "to": {
      "content_hash": "058633d3017cdf9281eb26e5981a03dea9e581e09c6851ac50c1aae7cd4481b7",
      "id": "w-source-f4a9c46d8b6e8da2",
      "revision": 1
    },
    "warrant": "AF3 paper explicitly states its architecture 'echoes that of AF2' and describes modifications to the trunk and structure module, establishing AF2 as the direct predecessor."
  },
  {
    "basis_relation": {
      "content_hash": "9535fca28575ea0282f18650b1a89daec8b8fa88078a904a18572dbf52aace16",
      "id": "bridge-66751aa79669d373",
      "revision": 1
    },
    "content_hash": "fd4e3fdcd0972245212f4503a6738554cafa1ddc3c7776b38a6ce0a6dbcf366c",
    "from": {
      "content_hash": "18c7b3ffeea3a9905171974dd551fc078dd40b2be20658941db80c7e46980e27",
      "id": "w-source-057b1d8c009ba859",
      "revision": 1
    },
    "id": "wr-d13350730ddd0f84",
    "kind": "insight_projection",
    "predicate": "historical_basis_for",
    "provenance": [
      {
        "note": "Evidence anchor p14 at source revision 1",
        "title": "Accurate structure prediction of biomolecular interactions with AlphaFold 3",
        "url": "https://www.ebi.ac.uk/europepmc/webservices/rest/PMC11168924/fullTextXML"
      },
      {
        "note": "Evidence anchor p12 at source revision 1",
        "title": "Accurate structure prediction of biomolecular interactions with AlphaFold 3",
        "url": "https://www.ebi.ac.uk/europepmc/webservices/rest/PMC11168924/fullTextXML"
      }
    ],
    "revision": 1,
    "scope": "This connection concerns the linked insights within these works, not every claim or the entire history of either work.",
    "to": {
      "content_hash": "058633d3017cdf9281eb26e5981a03dea9e581e09c6851ac50c1aae7cd4481b7",
      "id": "w-source-f4a9c46d8b6e8da2",
      "revision": 1
    },
    "warrant": "AF3 paper states the pairformer 'replaces the evoformer of AF2' and describes the simplification of MSA processing, indicating direct architectural evolution."
  },
  {
    "basis_relation": {
      "content_hash": "b270f213f4b9df6fb1deb7553fd1a86476dd2c8bc1bda70c093dfc2cf7aad3c6",
      "id": "bridge-83d538cb52505561",
      "revision": 1
    },
    "content_hash": "674c31fe7875e595f270278867df4a83161ca49e073abde11fb0a42f5d02599b",
    "from": {
      "content_hash": "889176f61fc028c97a0ea4730afecbc69c6b349272ce4ba03781662247ff9f65",
      "id": "w-source-7edb5c263f75a465",
      "revision": 1
    },
    "id": "wr-784e913d6d2ff36c",
    "kind": "insight_projection",
    "predicate": "historical_basis_for",
    "provenance": [
      {
        "note": "Evidence anchor p18 at source revision 1",
        "title": "New upper bounds on sphere packings I",
        "url": "https://arxiv.org/pdf/math/0110009"
      },
      {
        "note": "Evidence anchor p19 at source revision 1",
        "title": "New upper bounds on sphere packings I",
        "url": "https://arxiv.org/pdf/math/0110009"
      },
      {
        "note": "Evidence anchor p4 at source revision 1",
        "title": "The sphere packing problem in dimension 8",
        "url": "https://arxiv.org/pdf/1603.04246"
      }
    ],
    "revision": 1,
    "scope": "This connection concerns the linked insights within these works, not every claim or the entire history of either work.",
    "to": {
      "content_hash": "8d78387e58084993ac0fb774d8c2d50399ed3ad0a6f21ec46d1ea7825ccd345a",
      "id": "w-source-7414b1e9b6725a75",
      "revision": 1
    },
    "warrant": "Cohn and Elkies showed (Section 8) that if a function satisfying Conjecture 8.1 exists, then E8 and Leech lattices are unique periodic packings of maximal density. Viazovska's paper states 'the function g satisfies the conclusions of [4, Conjecture 8.1]. This implies the uniqueness of the densest periodic sphere packing in R8.'"
  },
  {
    "basis_relation": {
      "content_hash": "e520959f600e9341131cc12ed0f3160d68cad4b4415eda3ea78510c45dbfda29",
      "id": "bridge-8f0bc8688fc05516",
      "revision": 1
    },
    "content_hash": "538a93db4991d77ad6a240468a8fee118f3d8ab22814fafbc3e798f3c739647a",
    "from": {
      "content_hash": "889176f61fc028c97a0ea4730afecbc69c6b349272ce4ba03781662247ff9f65",
      "id": "w-source-7edb5c263f75a465",
      "revision": 1
    },
    "id": "wr-340e34bd694c05ab",
    "kind": "insight_projection",
    "predicate": "historical_basis_for",
    "provenance": [
      {
        "note": "Evidence anchor p17 at source revision 1",
        "title": "New upper bounds on sphere packings I",
        "url": "https://arxiv.org/pdf/math/0110009"
      },
      {
        "note": "Evidence anchor p1 at source revision 1",
        "title": "The sphere packing problem in dimension 8",
        "url": "https://arxiv.org/pdf/1603.04246"
      },
      {
        "note": "Evidence anchor p4 at source revision 1",
        "title": "The sphere packing problem in dimension 8",
        "url": "https://arxiv.org/pdf/1603.04246"
      }
    ],
    "revision": 1,
    "scope": "This connection concerns the linked insights within these works, not every claim or the entire history of either work.",
    "to": {
      "content_hash": "8d78387e58084993ac0fb774d8c2d50399ed3ad0a6f21ec46d1ea7825ccd345a",
      "id": "w-source-7414b1e9b6725a75",
      "revision": 1
    },
    "warrant": "Cohn and Elkies conjectured (Conjecture 7.3) that functions satisfying their Theorem 3.2 hypotheses solve the sphere packing problem in dimensions 2, 8, and 24. Viazovska's paper proves Theorem 1 (Delta_8 = pi^4/384) by constructing such a function g, thereby confirming the conjecture for dimension 8."
  },
  {
    "basis_relation": {
      "content_hash": "807796754d4b118dfbd98ccf04e9314e150acb75b6914e569baccef3350d75b6",
      "id": "bridge-cd4c31c94a48f027",
      "revision": 1
    },
    "content_hash": "df16ffc619e141b435af4c0ea0023f401b1167f3377151143b37379eacf5f6bb",
    "from": {
      "content_hash": "18c7b3ffeea3a9905171974dd551fc078dd40b2be20658941db80c7e46980e27",
      "id": "w-source-057b1d8c009ba859",
      "revision": 1
    },
    "id": "wr-6a32840cd7f0fbba",
    "kind": "insight_projection",
    "predicate": "historical_basis_for",
    "provenance": [
      {
        "note": "Evidence anchor p12 at source revision 1",
        "title": "Accurate structure prediction of biomolecular interactions with AlphaFold 3",
        "url": "https://www.ebi.ac.uk/europepmc/webservices/rest/PMC11168924/fullTextXML"
      },
      {
        "note": "Evidence anchor p15 at source revision 1",
        "title": "Accurate structure prediction of biomolecular interactions with AlphaFold 3",
        "url": "https://www.ebi.ac.uk/europepmc/webservices/rest/PMC11168924/fullTextXML"
      }
    ],
    "revision": 1,
    "scope": "This connection concerns the linked insights within these works, not every claim or the entire history of either work.",
    "to": {
      "content_hash": "058633d3017cdf9281eb26e5981a03dea9e581e09c6851ac50c1aae7cd4481b7",
      "id": "w-source-f4a9c46d8b6e8da2",
      "revision": 1
    },